{
  "$schema": "../../../../schemas/v3/view.v3.schema.json",
  "id": "54917d0d-3162-43f5-8daf-77abdbbc2771",
  "name": "セッション別発音平均ビュー",
  "description": "pronunciation_scores テーブルからセッション単位で平均スコア・最高スコア・採点回数を集計するビュー。セッション結果画面 (S-3) のサマリ表示と、ダッシュボードの学習進捗グラフ用データとして使用する。",
  "maturity": "draft",
  "createdAt": "2026-05-04T00:00:00.000Z",
  "updatedAt": "2026-05-04T00:00:00.000Z",
  "physicalName": "v_session_pronunciation_avg",
  "selectStatement": "SELECT\n  ps.session_id,\n  ls.user_id,\n  AVG(ps.score)    AS avg_score,\n  MAX(ps.score)    AS max_score,\n  MIN(ps.score)    AS min_score,\n  COUNT(ps.id)     AS score_count,\n  MAX(ps.created_at) AS last_scored_at\nFROM pronunciation_scores AS ps\nINNER JOIN learning_sessions AS ls ON ls.id = ps.session_id\nGROUP BY ps.session_id, ls.user_id",
  "outputColumns": [
    {
      "physicalName": "session_id",
      "name": "セッションID",
      "dataType": "INTEGER",
      "description": "集計対象の学習セッション ID。"
    },
    {
      "physicalName": "user_id",
      "name": "ユーザーID",
      "dataType": "INTEGER",
      "description": "セッション所有者のユーザー ID。"
    },
    {
      "physicalName": "avg_score",
      "name": "平均スコア",
      "dataType": "DECIMAL",
      "description": "セッション内の発音採点の平均スコア (0〜100)。"
    },
    {
      "physicalName": "max_score",
      "name": "最高スコア",
      "dataType": "DECIMAL",
      "description": "セッション内の発音採点の最高スコア (0〜100)。"
    },
    {
      "physicalName": "min_score",
      "name": "最低スコア",
      "dataType": "DECIMAL",
      "description": "セッション内の発音採点の最低スコア (0〜100)。"
    },
    {
      "physicalName": "score_count",
      "name": "採点回数",
      "dataType": "INTEGER",
      "description": "セッション内の発音採点の合計回数。"
    },
    {
      "physicalName": "last_scored_at",
      "name": "最終採点日時",
      "dataType": "TIMESTAMP",
      "description": "最後に発音採点を実行した日時。"
    }
  ],
  "dependencies": [
    "fefa79cf-4721-4956-86bb-595427bf6f81",
    "d524cba6-0878-4cf5-ba70-deaa7b459103"
  ]
}
