{
  "$schema": "../../../../schemas/v3/view.v3.schema.json",
  "id": "6e6a9612-85c8-4541-a497-8851cea28f56",
  "name": "商品付き在庫ビュー",
  "description": "店舗別在庫テーブルに商品マスタと店舗マスタを JOIN し、在庫一覧画面 (S-1) および低在庫検出で利用する横断ビュー。quantity_available が @conv.limit.lowStockThreshold 以下の行を低在庫警告バッジ表示に使用する。",
  "maturity": "committed",
  "createdAt": "2026-05-02T00:00:00.000Z",
  "updatedAt": "2026-05-02T00:00:00.000Z",
  "physicalName": "v_inventory_with_product",
  "selectStatement": "SELECT\n  s.store_code,\n  s.name        AS store_name,\n  s.region,\n  p.product_code,\n  p.name        AS product_name,\n  p.category    AS category_name,\n  p.unit_price,\n  i.quantity_available,\n  i.quantity_reserved,\n  i.updated_at  AS inventory_updated_at\nFROM inventory AS i\nINNER JOIN stores   AS s ON s.id = i.store_id\nINNER JOIN products AS p ON p.id = i.product_id\nWHERE p.is_active = TRUE\n  AND s.is_active = TRUE\nORDER BY s.store_code, p.product_code",
  "outputColumns": [
    {
      "physicalName": "store_code",
      "name": "店舗コード",
      "dataType": "VARCHAR",
      "description": "店舗の業務識別コード (例: S-001)。@conv.regex.storeCode 準拠。"
    },
    {
      "physicalName": "store_name",
      "name": "店舗名",
      "dataType": "VARCHAR",
      "description": "店舗の表示名。"
    },
    {
      "physicalName": "region",
      "name": "地域",
      "dataType": "VARCHAR",
      "description": "店舗の地域区分 (例: 関東、関西)。"
    },
    {
      "physicalName": "product_code",
      "name": "商品コード",
      "dataType": "VARCHAR",
      "description": "商品の業務識別コード (例: P-0001)。@conv.regex.productCode 準拠。"
    },
    {
      "physicalName": "product_name",
      "name": "商品名",
      "dataType": "VARCHAR",
      "description": "商品の表示名。"
    },
    {
      "physicalName": "category_name",
      "name": "カテゴリ",
      "dataType": "VARCHAR",
      "description": "商品カテゴリ (例: 食料品、日用品、家電)。"
    },
    {
      "physicalName": "unit_price",
      "name": "単価",
      "dataType": "DECIMAL",
      "description": "税抜単価 (円)。"
    },
    {
      "physicalName": "quantity_available",
      "name": "在庫数",
      "dataType": "INTEGER",
      "description": "現在の引き当て可能在庫数。@conv.limit.lowStockThreshold 以下で低在庫警告。"
    },
    {
      "physicalName": "quantity_reserved",
      "name": "引き当て済み数",
      "dataType": "INTEGER",
      "description": "カート追加等で一時確保中の数量。"
    },
    {
      "physicalName": "inventory_updated_at",
      "name": "在庫更新日時",
      "dataType": "TIMESTAMP",
      "description": "在庫の最終更新日時。"
    }
  ],
  "dependencies": [
    "834ede22-3cb0-4dcf-aa8a-7c046664774a",
    "652cbbfe-17e2-4f23-a0c9-4403e6b23bb0",
    "fdf00088-87d1-40e8-9eba-65ef58a9bfe5"
  ]
}
