{
  "$schema": "../../../schemas/v3/view.v3.schema.json",
  "id": "ce75dd91-3e55-4e0b-ac2c-11108943a8cf",
  "name": "注文明細詳細ビュー",
  "description": "注文明細テーブルに注文テーブルと商品マスタを JOIN し、注文詳細画面および配送指示画面 (S-4) で注文番号・商品情報を含む明細を表示するためのビュー。スナップショット列を優先使用し、商品マスタ JOIN は補完情報提供が目的。",
  "maturity": "committed",
  "createdAt": "2026-05-02T00:00:00.000Z",
  "updatedAt": "2026-05-02T00:00:00.000Z",
  "physicalName": "v_order_items_detail",
  "selectStatement": "SELECT\n  oi.id                        AS order_item_id,\n  o.order_number,\n  o.status                     AS order_status,\n  o.ordered_at,\n  oi.product_code_snapshot     AS product_code,\n  oi.product_name_snapshot     AS product_name,\n  p.category                   AS category_name,\n  oi.unit_price_snapshot,\n  oi.quantity,\n  oi.line_amount,\n  o.shipping_address\nFROM order_items AS oi\nINNER JOIN orders   AS o ON o.id = oi.order_id\nLEFT  JOIN products AS p ON p.id = oi.product_id\nORDER BY o.ordered_at DESC, oi.id",
  "outputColumns": [
    {
      "physicalName": "order_item_id",
      "name": "注文明細ID",
      "dataType": "BIGINT",
      "description": "注文明細のサロゲートキー。"
    },
    {
      "physicalName": "order_number",
      "name": "注文番号",
      "dataType": "VARCHAR",
      "description": "親注文の顧客向け番号 (例: ORD-2026-000001)。"
    },
    {
      "physicalName": "order_status",
      "name": "注文ステータス",
      "dataType": "VARCHAR",
      "description": "親注文のステータス (pending / confirmed / shipped / delivered / cancelled)。"
    },
    {
      "physicalName": "ordered_at",
      "name": "注文日時",
      "dataType": "TIMESTAMP",
      "description": "親注文の確定日時。"
    },
    {
      "physicalName": "product_code",
      "name": "商品コード",
      "dataType": "VARCHAR",
      "description": "注文確定時点の商品コードスナップショット。"
    },
    {
      "physicalName": "product_name",
      "name": "商品名",
      "dataType": "VARCHAR",
      "description": "注文確定時点の商品名スナップショット。"
    },
    {
      "physicalName": "category_name",
      "name": "カテゴリ",
      "dataType": "VARCHAR",
      "description": "商品カテゴリ (products テーブルから補完。商品廃止後は NULL)。"
    },
    {
      "physicalName": "unit_price_snapshot",
      "name": "単価スナップショット",
      "dataType": "DECIMAL",
      "description": "注文確定時点の税抜単価。"
    },
    {
      "physicalName": "quantity",
      "name": "数量",
      "dataType": "INTEGER",
      "description": "注文数量 (1 以上)。"
    },
    {
      "physicalName": "line_amount",
      "name": "行合計金額",
      "dataType": "DECIMAL",
      "description": "unit_price_snapshot × quantity (税抜)。"
    },
    {
      "physicalName": "shipping_address",
      "name": "配送先住所",
      "dataType": "VARCHAR",
      "description": "配送指示 (S-4) で使用する配送先住所。"
    }
  ],
  "dependencies": [
    "dddfb0c1-0fde-40ac-bcf0-5ed75a7f1edc",
    "10d555e2-8041-4192-86f3-9e2a3ac581ab",
    "652cbbfe-17e2-4f23-a0c9-4403e6b23bb0"
  ]
}
